{
  "$schema": "https://json-schema.org/draft/2020-12/schema",
  "$id": "https://schemas.apas.example/ii/v4/analysis-request.schema.json",
  "title": "I&I Analysis Request",
  "type": "object",
  "additionalProperties": false,
  "required": [
    "id",
    "tenant_id",
    "basin_id",
    "receiving_station_id",
    "event",
    "purpose",
    "calculation_profile",
    "requested_models",
    "status",
    "requested_by",
    "created_at"
  ],
  "properties": {
    "id": {"type": "string", "pattern": "^analysis_[a-z0-9_]+$"},
    "tenant_id": {"type": "string", "minLength": 3},
    "basin_id": {"type": "string", "minLength": 3},
    "receiving_station_id": {"type": "string", "minLength": 3},
    "event": {
      "type": "object",
      "additionalProperties": false,
      "required": ["id", "start", "end", "time_zone", "selection_method"],
      "properties": {
        "id": {"type": "string", "minLength": 3},
        "start": {"type": "string", "format": "date-time"},
        "end": {"type": "string", "format": "date-time"},
        "time_zone": {"type": "string", "minLength": 1},
        "selection_method": {"type": "string", "minLength": 1}
      }
    },
    "purpose": {
      "enum": [
        "event_screening",
        "station_consequence",
        "investigation_support",
        "rehabilitation_verification"
      ]
    },
    "calculation_profile": {"type": "string", "minLength": 1},
    "requested_models": {
      "type": "array",
      "uniqueItems": true,
      "items": {"enum": ["swmm", "epanet"]}
    },
    "status": {
      "enum": [
        "draft",
        "data_qualification",
        "blocked",
        "ready_to_calculate",
        "calculating",
        "technical_review",
        "rejected",
        "approved",
        "verification_planned",
        "closed"
      ]
    },
    "requested_by": {
      "type": "object",
      "additionalProperties": false,
      "required": ["actor_id", "actor_type"],
      "properties": {
        "actor_id": {"type": "string", "minLength": 3},
        "actor_type": {"enum": ["human", "service", "agent"]}
      }
    },
    "created_at": {"type": "string", "format": "date-time"},
    "correlation_id": {"type": "string", "minLength": 8}
  }
}
