{
  "id": "analysis_demo_event_001",
  "tenant_id": "tenant_synthetic_demo",
  "basin_id": "basin_synthetic_640ac",
  "receiving_station_id": "station_synthetic_001",
  "event": {
    "id": "event_synthetic_20260715",
    "start": "2026-07-15T00:00:00-04:00",
    "end": "2026-07-17T00:00:00-04:00",
    "time_zone": "America/New_York",
    "selection_method": "synthetic_fixed_window"
  },
  "purpose": "station_consequence",
  "calculation_profile": "station_consequence_v1",
  "requested_models": [
    "swmm",
    "epanet"
  ],
  "status": "draft",
  "requested_by": {
    "actor_id": "user_synthetic_engineer",
    "actor_type": "human"
  },
  "created_at": "2026-07-29T09:00:00-04:00",
  "correlation_id": "corr_synthetic_0001"
}
